MisconceptionId,MisconceptionName
1728,"When solving a pair of simultaneous equations, thinks they need to make the coefficients of both variables the same"
1729,"When solving simultaneous equations, finds the correct numbers to transform the equations, but uses them the wrong way around."
1732,Thinks a factor tree splits a number into a pair of numbers that sum to the given number.
1736,Believes clock times can be written with a decimal point rather than a colon
1739,Does not understand changing decimals to fractions
1742,Adds or subtracts the degree of accuracy from the original number
1745,Believes a quadratic graph can be a straight line
1747,"When using the capture-recapture method of sampling, believes you multiply the number caught second by the number marked second to get the best estimate of population size"
1750,"Adds ""100"" to end of written value rather than multiplying by 100"
1753,Believes a direct proportion graph can have a negative gradient
1754,Thinks two-tailed inequalities can have a constant in the middle
1758,Can not recognise all factor pairs of numbers
1762,"Thinks that when drawing the plan view, the top layer of the shape needs to be drawn in the row above "
1765,"Does not understand how to answer generalised statements (eg. by testing values to check for always, sometimes, never)"
1768,Believes the y-intercept of a line is the solution to its equation
1770,Believes the proportion for a pie chart sector is 1 divided by the number of degrees
1772,Believes a reciprocal graph comes from a cubic equation
1774,"When multiplying a surd by an integer to write as one surd, squares the number under the surd rather than the number in front"
1777,Confuses the graph of 1/x with 1/x² when both are shown
1778,Believes you subtract the number marked second from the estimated population to find the number marked first when using the capture-recapture method
1780,Thinks all dimensions given must be used when calculating the area
1785,Added the base numbers
1789,Thinks the elevation is taken from an angle to include aspects of the other side
1797,Assumes the range of a set of data starts at zero
1798,Believes 1 is a prime number
1799,"When converting fraction to ratio, thinks you just use the numerator and denominator as the numbers in the ratio "
1801,Believes they always divide by the conversion factor when converting units
1802,Adds instead of subtracts when finding the area of part of a shape
1804,"When dividing fractions, multiplies the numerators and multiplies the denominators"
1808,does not realise that the product of prime factors will also be a factor of the original number 
1812,"When multiplying fractions, adds the denominators and multiplies the numerators"
1816,"Believes the probability on all branches travelling in the same direction on a tree diagram are the same, despite changing events"
1817,Rounds every number down when estimating
1821,"When finding the nth term rule for a quadratic sequence, believes that the coefficient of n squared is the second difference"
1822,Thinks they multiply the numerator and denominator together to convert a fraction to a percentage 
1826,Believes the solution of a quadratic is its turning point
1827,Believes the upper bound of an interval in a grouped frequency table is equivalent to the group width of the interval
1829,Believes they must change the direction of the inequality when dividing through by a positive number.
1830,Thinks area of a circle = radius x pi 
1833,"When drawing a histogram, thinks you plot frequency on the horizontal axis"
1838,"Confuses the roles of initial capture, recapture, and total population in the capture-recapture method"
1843,"When using interpolation to estimate frequency that is above a certain value, believes they can add the estimated frequency up to that value in its class, rather than the estimated frequency after it"
1844,Uses length scale factor for area without squaring 
1848,Thinks the y coordinate of a point on the x axis is 1
1853,Thinks an enlargement of any scale factor keeps side lengths the same
1855,"Believes that if one number in a product decreases, the answer must increase. "
1856,Thinks multiplication and addition are the same
1857,Believes a cubic equation will have a linear graph
1859,Thinks the mode in a stem and leaf diagram  is the stem that has the most leaves 
1865,"When dividing numbers with different bases, subtracts the powers and subtracts the base numbers."
1867,Finds unit price then forgets to multiply up
1873,Believes the median is the midpoint of the range
1874,Believes the median is the frequency for the category in which it is located
1878,"In inverse proportion, believes that if one variable is a reciprocal, the other variable will be the reciprocal as well. "
1879,Believes midpoint of an interval is used rather than total frequency to calculate the sector angle for a pie chart
1888,Does not know the information each vertical line of a box plot represents
1890,Thinks the multiplication sign means to add
1891,Believes they can cross-cancel before flipping the second fraction when dividing fractions
1892,Does not recognise the sin graph
1899,Thinks the missing length has to be half the length of the side given
1901,Subtracted base numbers as well as powers
1903,Thinks all lines on a net will form edges in 3D
1904,Believes the numbers in factorising should multiply to give the coefficient of x and add to give the constant
1905,Believes that when finding bounds you round to the nearest whole number
1910,Confuses relative frequency and expected frequency
1913,"Gives the smallest whole when asked for the smallest fraction shaded, presented visually"
1919,Believes that a fractional index also means you need to find the reciprocal
1922,Gets the dividend and divisor the wrong way round when doing long division
1926,"Believes you use the half of the base length to find the area of an isosceles triangle, following using it to find the perpendicular height"
1928,Mixes up the numerator and denominator
1930,Believes it's ok to change the scale on an axis for the negative values
1931,Believes the opposite side is where the adjacent side is in a right angled triangle
1933,Believes that the reciprocal of a number is equal to that number (1/x = x)
1934,Multiplied by the scale factor rather than divided in direct proportion problems
1935,"Divides length of original by length of image to find scale factor, rather than image by original."
1936,Believes the integer can be written before or after the surd eg. 3√2 = √2 3
1938,Ignores zeros when giving the value of an integer
1941,"Confuses the order of operations, believes subtraction comes before multiplication "
1943,Includes the intersection of a Venn diagram when asked to find the value of a set only
1947,Writes more than three repeated symbols next to each other in Roman numerals
1949,"Believes reflection in y=-x switches the signs of the coordinates, but not their numbers"
1951, Does not believe that a negative multiple of a vector is in the opposite direction
1952,Confuses class width and frequency when calculating frequency density
1955,Thinks that a percentage can be converted to a fraction using a denominator of 10 
1961,Fails to identify mirror line
1962,Doesn't take into account cost when calculating expected return/profit
1964,Estimates obtuse angles as 90 degrees or less
1967,Counts a side length more than once when counting perimeter due to not marking a starting point
1969,Mixes up square numbers and even numbers
1974,Believes the gradient of a line is the root of its equation
1975,Does not understand the question
1977,Confuses section and whole when using a bar model
1979,"Believes that they can reverse a percentage increase by decreasing the new value by the same percentage, and vice versa"
1983,"When dividing involving a multiple of 10, gives an answer 10 times smaller than it should be "
1991,Assumes any variable in a sum on the numerator can be divided by the denominator
1998,"When finding which term represents the median, thinks you divide the total number of terms by 2"
2000,Believes multiplying by 0.1 is the same as multiplying by 10
2001,"When solving an equation,  subtracts instead of multiplying"
2004,Confuses frequency polygons with cumulative frequency diagrams
2005,Multiplies all given dimensions when calculating the length of the hypotenuse in a right angled triangle
2008,"When substiting into an algebraic term, raises the coefficient to the power of the variable rather than multiplying the coefficient and the variable.."
2010,Does not understand power notation
2013,"When drawing a histogram, thinks you plot cumulative frequency on the horizontal axis"
2014,Believes if a point is reflected in the line x=a then the x coordinate of the point will become 'a'
2015,Forgot to square both parts of the fraction
2018,Thinks a divide and a negative sign next to each other makes a minus
2019,"When there's a negative sign in the question, thinks the answer must be negative"
2025,Does not realise a triangular prism is a 3D shape
2028,"When writing a number between zero and one in standard form, thinks the power is the negative of the number of decimal places"
2029,Believes non-unit multiples of vectors can be the same length
2033,Rounds to the wrong degree of accuracy (1 decimal place rather than nearest whole number)
2036,Identified the interior not exterior angle at a point
2040,Has estimated the length of the missing side length by looking at the image  rather than calculating it
2041,Fails to reflect across reflection line without a diagram
2052,Believes all numbers written in standard form must be smaller than any numbers written in ordinary form
2057,Thinks that the scale on axes has to match with the number of squares
2058,Assumes there are only 2 terms in the nth term formula for a quadratic sequence
2059,Ignores unlabelled angles when applying angle sum rules
2060,"When solving simultaneous equations graphically, they think the solutions are the x or y intercepts"
2061,"Believes that when converting ratio to fractions, the denominator is the difference between the parts of the ratio"
2062,Believes you multiply all of the values given when using the capture-recapture sampling method
2063,"When calculating volume expressed in cubes, counts the faces of all the cubes"
2064,"Finds the range of possible values of the variable, rather than the range of recorded values"
2065,Believes when calculating a probability the denominator will be the total of one of the criteria rather than the overall total that is required (gives a given that answer)
2067,Thinks there are 10000ml in a litre
2070,"Believes that when factorising a quadratic equation with a coefficient of x squared, the two constants in the brackets are still the solutions of the equation with opposite signs"
2074,"When describing the relationship between the parts in a ratio, replaces the : with a decimal point to say how many times bigger a part is than the other"
2075,Misunderstands mixed number notation 
2076,Believes an algebraic term with the same coefficient as the value of a constant term can be subtracted to give zero
2079,Believes that points on an axis have equal x and y coordinates
2086,"When calculating volume expressed in cubes, counts only the squares on one face"
2088,"When multiplying variables, thinks they add coefficients as well as powers"
2089,"When asked to find a scale factor, assumes direction of enlargement does not matter"
2096,When adding negatives believes that they can just add their absolute values and add a negative sign to the answer
2097,Confuses prime factors and factors
2099,Believes negative powers in standard form have the same impact as positive powers 
2106,"When asked to find an angle given in three letter convention, thinks the angle you want to find will be located at the vertex labelled with the last letter"
2108,"Believes if a circle is divided into n equal sectors, the angles at the centre will each be n degrees"
2115,Believes any of the angles can be used in the trigonometric formula for area of a triangle
2116,Does not round up when an answer is non-sensical in a real-life context
2118,Struggles to visualise elevations of 3D shapes
2120,Believes they do not have to say the point when reading a decimal aloud
2129,Increases by the given percentage rather than finding the percentage of an amount
2136,"When finding the square root of a decimal, ignores place value"
2141,Believes that 'zero' is read as the letter 'O'
2144,Believes a number written in standard form cannot have a lot of decimal places
2146,Believes the line y = mx - c will cross the y axis at c
2151,Thinks you cannot find the range if there are an even number of values
2153,Thinks the category with the most common bar height is the mode
2158,Multiplies rather than divides when answering worded problems
2164,Believes a number written in standard form is smaller than another number written in standard form if the number between 1 and 10 is smaller
2165,Thinks that we cannot calculate the range of negative numbers
2167,"When a subtraction of one positive number from another, results in a negative answer, they believe the answer is the sum of those 2 numbers with a negative sign put in front."
2168,Assumes a 1:1 conversion ratio between different currencies
2169,Believes that prime numbers can have more than two factors
2170,Subtracts numerators when dividing fractions with a common denominator
2171,Uses the total as the numerator of the fraction rather than the denominator.
2172,Subtracts instead of adding when asked to find a total
2174,Believes a parallelogram cannot have right angles
2176,Confuses objective and subjective
2177,Does not know that a reflection would not change the size of the shape
2182,Believes given two sides and one angle of a triangle there are multiple ways to draw the triangle
2183,Confuses consecutive and prime numbers
2184,Believes the equation of a straight line is y=-mx+c
2186,Thinks the missing length has to be half the length of the opposite side
2188,"Does not understand that enlargements can make shapes make shapes bigger, smaller and the same size"
2194,Assumes the scale is the same when comparing two similar diagrams
2195,Does not know the definition of a prime number
2196,Believes the number of bars gives the total on a bar chart
2200,Believes that when dividing an integer by a power of 10 you add zeroes after the decimal point
2201,Does not know the definition of a composite number
2202,Thinks we have to add the base numbers as well as the powers when multiplying indices
2205,Thinks the largest number in a stem and leaf diagram comes from the first leaf next to the largest stem
2207,Believes we can categorise data as primary or secondary without knowing the source
2211,Believes interquartile range is the sum of the lower and upper quartiles
2213,Assumes regular shape refers only to a square
2216,Believes the mean from grouped data something divided by the sum of the midpoint values
2219,"Believes any co-interior angles are supplementary, not just those in parallel lines"
2222,Out by 10 when subtracting
2223,"When dividing fractions, divides the denominators by each other"
2224,Does not recall larger square numbers
2227,Subtracts rather than adds when using Pythagoras to find the hypotenuse
2229,Believes the mean is something divided by total
2232,Thinks that perpendicular lines do not meet at 90 degrees
2233,Thinks the reciprocal of a fraction is what number adds to that fraction to make one whole.
2235,Gives the first significant figure when asked for the second
2236,Does not know that co-interior angles sum to 180 degrees
2242,Converts a fraction to a decimal by placing the denominator after the decimal point
2243,Believes quartiles are at 1/4 and 3/4 through the range of the data
2244,"Thinks there are 10,000g in a kilogram"
2246,Answers as if there are 10 seconds in a minute when changing from seconds to minutes
2247,Does not understand that a number is divisible by the factors of its factors
2249,Confuses calculations for cumulative frequency and estimated total from a grouped frequency table
2253,Believes the position number in a sequence does not have to be an integer
2254,Removes the decimal point when asked to round a decimal to a whole number
2255,Believes you subtract the number caught second from the estimated population to find the number marked first when using the capture-recapture method
2257,Believes you always reduce the numerator and denominator by 1 when writing the probability for a second pick without replacement on a tree diagram
2258,Believes when writing a number in standard form as an ordinary number you write any digits in the base (omitting the decimal point) and do not account for the power of 10
2259,Believes the mean is something divided by the sum of the categories given
2267,Chooses an incorrect point on the object when describing a 90 or 270 degree rotation
2268,Thinks the x coordinate of a point on the y axis is 1
2272,"When dividing involving a multiple of 10, gives an answer 10 times bigger than it should be "
2274,"When dividing variables, thinks they subtract coefficients as well as powers"
2276,Has considered the percentage rather than the percentage of the amount
2277,"When factorising into double brackets, finds the correct values for the non variable terms but swops the plus and minus sign"
2278,Subtracts rather than divides when answering worded problems
2281,Does not understand which months are in the Spring
2283,"When finding the missing length on similar shapes, just finds the difference between the given lengths"
2287,Believes multiplying together all prime factors gives the highest common factor
2290,Uses the same value for both coordinates
2293,Thinks the orientation of the side view does not matter when identifying the direction of view
2294,Believes that Mid point multiplied by the Frequency in a grouped frequency table gives the frequency for that group.
2295,Believes probabilities can be greater than 1
2298,Mixes up smallest and greatest when ordering positive integers
2299,Believes any sample gives an equal chance of selection
2300,Forgets to include a marked right angle when performing angle calculations
2304,"Believes that Mid-point x Frequency in a grouped frequency table gives an accurate total, rather than an estimate."
2310,Does not know how to find the gradient of a straight line from two points
2313,Mixes up discrete and continuous data types
2315,Confuses negative and positive correlation
2322,Believes a percentage of a number will be a multiple of the percentage
2323,"When ordering decimals, believes the decimal point is not relevant"
2324,Believes the y-intercept of a line is the root of its equation
2325,Believes data implies equal chance of selection
2328,"When using the capture-recapture method, believes the number caught second is the numerator and the number marked second is the denominator"
2335,"When multiplying decimals, multiplies rather than divides when reinserting the decimal."
2337,"Struggles to visualise how an object will look in 3D when given a plan view, front and side elevation"
2338,Believes the lower quartile is the lowest value in a list
2339,Believes that reciprocals are undefined for negative numbers
2342,Believes they add the conversion factor when converting between units
2347,Believes class width divided by frequency density gives frequency in a histogram
2348,Believes the number of edges on a 3D shape match those of the 2D cross section
2358,Believes even numbers can have odd multiples
2360,Thinks the scale factor is found by adding the lengths of two corresponding sides together
2366,Mixes up the words “to” and “past” when telling the time
2367,Confuses dependent and mutually exclusive events
2369,Does not know protractor should be positioned with one side of the angle at 0
2370,Uses angles on a straight line in the wrong context 
2372,"Believes that when factorising a quadratic with a coefficient of x squared, the two constants in the brackets still add to give the coefficient of x"
2379,Unable to equate two divisions with a single division
2381,"Confuses the lower bound and upper bound, and writes the lower bound as a value that would end in recurring 9's, for example"
2382,Believes that y = m +cx is the equation of a straight line
2383,When multiplying by 1 gives an answer of 1 (for a number other than 1)
2385,Thinks that the lower and upper bound for a truncated number can be found in the same was as when it has been rounded
2387,"When finding a fraction of a fraction, divided by the whole fraction instead of the denominator"
2390,"Believes rounding to 1 significant figure means rounding to the nearest integer, regardless of the value of the number"
2391,"Believes the median is the middle category in a table, ignoring the frequencies"
2393,Believes the midpoint of grouped data is equivalent to the group width
2394,Does not know the properties of an equilateral triangle
2396,Adds a zero onto the end of units multiplied by units when solving multiplication problems using the grid method
2400,"Believes that if the numerators of 2 fractions are equal then the fractions are equal, regardless of the denominator"
2403,Believes the columns in a base are multiples not powers of the base
2404,"When using the capture-recapture method of sampling, believes you multiply the number marked first by the number marked second to get the best estimate of population size"
2405,Arithmetic error when dividing by 8
2406,"When multiplying a fraction by an integer, believes the integer will become the denominator of the fraction"
2407,Believes an arithmetic sequence can have a common second difference rather than first difference
2409,Believes you place the digits next to each other for a multiplication sample space diagram
2410,Believes an outlier has to be a whole number
2411,"When multiplying large numbers, splits numbers into addends rather than factors"
2418,Believes the universal set symbol means any elements not within a circle. 
2419,Combines digits instead of applying the mathematical function
2420,Thinks direct proportion rules apply to inverse proportion problems
2421,Believes a rectangle has one pair of equal sides
2422,Tries to add or subtract unlike terms
2429,Believes finding a fraction of an amount means multiplying by the denominator
2430,Does not consider fractional parts when solving proportion problems
2431,"When two digits multiply to 10 or more during a multiplication problem, does not add one to the preceding digit"
2434,Ignores position/value of midpoint when trying to label a point on scale
2439,Does not understand that removing an outlier will impact the range
2440,Finds the circumference instead of the area
2441,Thinks multiplying by a number is the same as raising to the power of that number
2444,"When converting compound measures into different units, thinks you multiply when the unit of the divisor has become smaller"
2448,Cannot evaluate if an estimate is an underestimate or overestimate
2449,Done a different calculation to the one given
2451,When multiplying a vector by an integer does not multiply all parts of the vector
2452,Believes a parallelogram has one pair of equal sides
2455,Tries to apply sohcahtoa to a non right angled triangle
2459,Believes alternate angles sum to 180 degrees
2460,Does not recognise an example of the angles in same segment theorem
2462,Confuses the position of the median with its value
2463,"When multiplying an integer by a fraction, believes the numerator of the fraction will become the denominator"
2467,Does not know the meaning of the word equidistant 
2468,Does not know that three quarters of a turn is 270 degrees
2471,Believes the range is largest add smallest
2477,Thinks there are 30 seconds in a minute
2478,Thinks the plan view is from the side of the shape
2482,Has written something to the power of 1 as 0.1
2483,Believes that a negative sign in the base of a power means you need to find the reciprocal 
2486,Identifies the wrong two angles as base angles of an isosceles
2490,Assumes Pythagoras' theorem doesn't work if they can spot a pattern between the side lengths
2495,Compares sizes of angles on a grid by estimating rather than using the gradient of the lines
2496,"Believes composite function notation fg(x) means to multiply the first terms of f and g together, and the second terms of f and g together"
2497,Believes f(x - a) translates the function down a units
2498,Thinks I can be subtracted from L in Roman numerals
2502,Believes a reciprocal equation will have a quadratic graph
2503,Believes that a greater percentage represents a greater quantity
2506,"Believes cumulative frequency is the sum of each class with the previous class, rather than all previous classes"
2509,Mixes up the sets in a Venn diagram
2513,"When finding the nth term rule for a quadratic sequence, believes that the coefficient of n squared is determined by first differences"
2518,May have made a calculation error using the order of operations
2521,Does not know how to measure reflex angles
2522,Believes the total of the circle in a Venn should be included when intersections should be omitted
2523,Has added on the power of 1/4 rather than raise to the power of 1/4
2526,Believes a downward line has a positive gradient
2527,"Writes a repeated root once, rather than in a squared bracket"
2528,Thinks that the perimeter on a square grid is the number of squares surrounding the rectangle
2529,Does not think a ton is a unit of mass
2533,Does not realise that two letters together are multiplying
2534,When converting between non standard form and standard form assumes changes to the base will not affect the power
2536,Misunderstands the capture-recapture method
2538,Confuses the value of the variable with cumulative frequency
2540,Confuses maximum and minimum
