MisconceptionId,MisconceptionName
1153,Believes they can ignore the coefficient when expanding double brackets 
2225,Thinks signs are interchangeable when adding or subtracting positive and negative numbers
2565,Confuses the hundreds and thousands place value columns
2311,Divides rather than adds when answering worded problems
833,"When calculating perimeter, multiplies instead of adds"
935,Fails to use the properties of simple shapes to work out missing lengths
890,Thinks they had to give the new amount rather than the total percentage that the original has been increased by.
27,Believes squaring a fraction requires you to double both parts
2491,"Thinks that in the equation x=a, a is the gradient"
989,Does not understand that area under a speed time graph gives distance because distance = speed x time
1552,"Believes term to term rule is applied to position number, not previous term"
804,Believes percentages cannot be converted into fractions
635,Believes you cannot find the angle size in a pie chart when given its percentage value
2011,"When simplifying surds, leaves the square root of the biggest square number under the root and puts the other number on the outside"
578,Does not recognise when a surd can be simplified
1796,Thinks a positive x value in a column vector means to move left rather than right
566,Thinks the inverse of subtraction is division
773,Does not understand to find each interior angle of a regular polygon you divide the sum by the number of sides
568,"When solving a problem that requires an inverse operation (e.g. missing number problems), does subtraction when division is required"
2007,Believes the number of vertices on a 3D shape match those of the 2D cross section
870,Only counts visible vertices
2416,Finds the difference in a coordinate pair rather than the midpoint
2103,Believes h in the formula for area of a trapezium stands for half the sum of the parallel sides
2047,Believes infinite gradient is not possible in real life. 
1428,"Does not understand the meaning of ""value"""
242,Thinks the hundred thousands column is the ten thousands column
1016,Confuses the hundreds and hundred thousands place value columns
2090,Finds the area of the whole grid instead of the shaded shape
496,"When subtracting decimals with a different number of decimals, subtracts one digit from more than one column"
1113,"When substituting a value into a non-linear term with a coefficient, multiplies by the coefficient then calculates the power."
64,Mixes up squaring and multiplying by 4
393,Believes adding coordinates of endpoint and midpoint of a line will give the other endpoint
820,Does not know that you can leave a fraction in improper form
281,Thinks that if two lines do not intersect on a diagram then they will never intersect and are therefore parallel
2317,"When asked for the next term in the sequence subtracts one from the last term given, despite the sequence not going down in ones."
933,Does not know the meaning of corresponding
962,Thinks 1 cubic metre = 1000 cubic centimetres
2371,Believes a direct proportion graph is a horizontal line
300,Believes a direct proportion graph does not have to start at the origin
965,Adds the numerators when working out a combined probability
621,Believes the negative of a positive squared (where there are no brackets) gives a positive answer
2280,"Believes change in y for gradient is always calculated from the origin, regardless of the y-intercept of the line"
284,Believes the gradient of a speed-time graph is the speed
1559,Believes a downward slope on a speed-time graph shows positive acceleration
866,Believes that the y intercept is where y = 0
1642,"When adding roots, adds the numbers under the roots"
524,Does not understand square root
162,Uses first term as numerical part of nth term rule
941,Does not recognise that subtracting a larger number from a smaller number will give a negative answer
1224,Does not understand the diagram given in the question
292,Converts fraction to percentage by putting % sign after the denominator
400,Thinks multiplying a variable by a number is the same as raising that variable to the power of that number
1114,Believes they can change the subject of a formula just by swapping two letters
245,Does not realise that to maintain balance in an equation they must add or subtract the same amount from both sides
2456,Finds the mode rather than the range
1349,Does not include negative numbers when calculating a range
1500,"When calculating a scale factor, thinks the division is the other way around."
2442,"When calculating a scale factor, multiplies instead of dividing."
1258,"When calculating a scale factor, thinks they need to subtract rather than divide."
95,Does not know about the + notation for directions in rotations
