MisconceptionId,MisconceptionName
1672,"Confuses the order of operations, believes addition comes before multiplication "
847,Thinks they can convert a 2 digit percentage to a fraction by writing one number over the other.
2133,"When dividing a decimal by a multiple of 10, just divides the fractional place values "
1889,Believes f(x - a) translates the function up a units
1234,Believes f(x + a) translates the function up a units
1588,Thinks only angles on parallel lines can be alternate
2179,Assumes that an arrow on a number line starts at zero
1916,"When subtracting fractions, subtracts the numerators and multiplies the denominators"
2147,Believes they should multiply each numerator by its original denominator when adding/subtracting fractions
2474,Confuses the square root of the radius with the radius squared in the equation of a circle
1944,Confuses the radius with the radius squared in the equation of a circle
98,Incorrectly clears fractions from equations
218,Does not interpret a sloping gradient as a change in rate
961,Does not spot the difference between a gradual change of gradient and 2 distinct line segments with different constant gradients
2021,Does not recognise when a fraction can be simplified
1958,"Believes the smaller number is always subtracted from the larger, regardless of the order of the calculation"
959,Believes it is impossible to subtract a bigger number from a smaller number
182,Believes parallel lines have gradients of opposite signs
1461,Believes parallel lines have gradients that multiply to give -1
630,Does not know parallel lines have equal gradients 
646,Confuses scalene and right angle triangles
944,"When dividing involving a power of 10, gives an answer 10 times bigger than it should be"
544,When dividing a decimal by a power of 10 adds zeroes to start of the number ignoring the placement of the initial decimal point
964,"When dividing involving a power of 10, gives an answer 10 times smaller than it should be"
1734,Thinks that we can remove a division symbol and just write the variables next to each other
499,Does not realise ratio in worded problem can be simplified
2178,Believes mixed numbers cannot be simplified
1068,Believes the fx column for calculating mean is value + frequency
352,Believes the fx column for calculating mean is value - frequency
2159,Believes the fx column for calculating mean is value/frequency
1894,Confuses the part and the whole in missing number subtraction problems
1751,Does not realise we can borrow from the preceding digit in a subtraction problem
882,Believes 0 has no square root
2023,Thinks when finding a percentage you divide by the percentage being asked
2083,Thinks y =1 is the y axis
272,When finding a missing side of a parallelogram given the area completes an extra step of dividing by 2
2397,Does not realise we can find a missing length if we know the base of a parallelogram and its area. 
1771,Believes the solution of a quadratic inequality is always the interval between the roots
1590,Believes any two inequalities can be combined into a double inequality
1468,Orders integers based on first digits without taking into account place value
1744,Rounded to nearest 100 instead of 1sf
2091,Thinks depth always goes front to back in a diagram of a 3D shape
2218,Assumes that opposite angles are equal in a quadrilateral
460,"Believes the graph of x squared + c has the turning point of (-c, 0)"
492,"Believes the graph of x squared + c has the turning point of (c, 0)"
290,Thinks a decreasing sequence cannot be quadratic
372,"In ratio question where the difference between the sides is given, uses that as the total"
532,Confuses alternate and opposite angles
463,Reads the complement of what is required from a pie chart
1396,Finds a percentage when asked for a fraction
1326,Does not know the meaning of square sign for right angle
867,When finding the area of a parallelogram does not understand which lengths to use
695,Has found the area of a triangle rather than an area of a parallelogram
1362,Believes that the angle on a pie chart is the frequency multiplied by 10
1008,"When dividing an integer by a fraction, thinks they multiply numerator and denominator by the integer"
839,"When dividing by a non unit fraction, thinks you multiply by the reciprocal of the corresponding unit fraction rather than the fraction given. "
851,Thinks a negative x value in a column vector means to move right rather than left 
2173,Does not realise that division can be used to find the missing value in a multiplication problem
1600,Thinks a lower average means the data is more consistent
1923,Thinks a greater range means more consistent data
880,Thinks a higher average means more consistent data
1425,Believes two lines of the same length are parallel
2475,"When finding the nth term rule for a quadratic sequence, believes they only need to use the first term to calculate the coefficient of n "
1406,Does not recognise that interior and exterior angles are supplementary
405,Believes the only way to find the interior angle of a regular polygon is to subtract the exterior angle from 180.
1724,"When completing the square, believes that a is always half the x-coefficient. "
1714,"When completing the square, believes the constant in the bracket is the square root of the coefficient of x"
271,Believes triangle numbers are formed differently to the correct way
1915,When multiplying mixed numbers thinks they add the integers
1637,Has used the decimal point to separate numerator and denominator
1424,Thinks numbers greater than 1 cannot be converted into fractions
1169,Does not know that cubic means the same as cubed in units
322,Believes that rounding must change the number
1277,"In algebra, thinks it's ok to write (for example) 0x rather than just 0"
1093,Has multiplied the value of the first term by the the term being asked
2068,"Does not know that to factorise a quadratic expression, to find two numbers that add to give the coefficient of the x term, and multiply to give the non variable term

"
521,"When asked to triple, writes the digit out three times"
2163,Attempts to simplify ratio by subtracting from both sides
1350,"When simplifying a ratio, divides one side of the ratio but multiplies the other side."
1009,Does not know the meaning of bisect
863,Believes inequalities can only include integers
742,Believes solving an inequality gives a single value as a solution
2126,Miscounts when subtracting over zero
1561,Believes the mean is total frequency divided by something
1526,Believes that they only need to write non-zero digits when giving a number in digits
1525,Confuses written 'teen' numbers with their corresponding multiples of 10
2329,Thinks the remainder is the difference between the dividend and the next biggest multiple
1437,Assumes the fractional index denotes the root and power the other way around
88,Believes parallelogram is the term used to describe two lines at right angles
813,Believes parallel is the term used to describe two lines at right angles
2453,Believes particular is the term used to describe two lines at right angles
1230,Believes you cube the conversion factor when dealing with squared units
1263,Does not understand the definition of a rational number when it is a surd
874,Mistakes the place value column of hundred thousands with millions
2327,Does not understand that a space can be used to separate the thousands column from the hundreds column
2320,Subtracts rather than divides when scaling down in direct proportion problems
901,Finds unit price but doesn't multiply up for number in question
1995,Mixes up shortest and longest when ordering times
1557,Has an incorrect assumption about the definition of a reciprocal
1860,Believes a reciprocal graph can be a straight line
36,Enlarges by the wrong centre of enlargement
1726,Believes there is more than one line which passes through a given pair of points
1656,Believes that one point is enough to specify a line
1596,Has found the total as a percentage of the amount being asked
2551,Believes range does not need units
1222,Forgets the denominator in probability
1145,"When adding column vectors, multiplies rather than adds"
951,Only recognises the positive form of a quadratic graph
1806,Only recognises the negative form of a quadratic graph
1158,Believes you can go above an amount of money when finding how much of something you can buy
533,Does not consider the variable when evaluating an expression that requires substitution.
531,Thinks when finding a percentage you multiply by the percentage being asked
2009,"Assumes they add all values in a worded problem, thereby not interpreting the problem correctly"
1787,"When talking about money ""taken"" in a retail context, thinks that means take-away rather than add"
694,Confuses cubic and quadratic graphs
1460,Identifies second decimal place value when asked for the second significant figure
1420,"Believes that when eliminating a variable, regardless of the signs of the terms with matching coefficients, we subtract the equations"
893,"Believes when changing an improper fraction to a mixed number you divide the numerator by 10, regardless of the denominator"
1492,Believes the whole and remainder are the other way when changing an improper fraction to a mixed number
20,Believes the number of wholes in a mixed number multiplies by the fraction part
737,Thinks there are 30 minutes in a hour
307,"When using Pythagoras to find the height of an isosceles triangle, uses the whole base instead of half"
2473,Has cubed the base number and the power
1921,Does not understand laws of indices
364,Thinks they just remove the decimal point when converting a decimal to a percentage
2241,Confuses triangular prism with pyramid
9,Thinks there are 180 degrees in a full turn
1278,Believes the subscript in iteration notation is the value to be substituted
1418,"When the dividend is a mixed number and the divisor is an integer, thinks they only perform the calculation with the integers."
983,"When the dividend is a mixed number and the divisor is an integer, thinks they only divide the fraction by the integer."
1373,Does not recognise a unit of time
350,Forgets to carry the tens when doing column multiplication
1334,Tries to multiply within place value columns during column multiplication
1135,"When subtracting a negative number, adds the absolute values and then writes the answer with a negative sign"
1790,Does not know the correct notation for labelling a side length
829,Estimates angle rather than calculating
1610,Misunderstands the concept of common factors in algebra
1516,Performs addition ahead of any other operation
469,Believes the position of a sequence cannot be an integer
1354,Does not know how to calculate the position of a term in a sequence
1082,"When multiplying with negative numbers, assumes any negative sign can be ignored"
715,Removes the common denominator when making equivalent algebraic fractions
2187,"When multiplying a decimal less than 1 by an integer, gives an answer 100 times smaller than it should be"
1257,Assumes a 1/4 of a whole is 25
1963,Performs subtraction right to left if priority order means doing a calculation to the right first
1932,Counts partial symbols as if they were whole on pictograms
503,Ignores partial symbols on pictograms
6,Can identify the multiplier used to form an equivalent fraction but does not apply to the numerator
1440,Believes 180 degrees is an obtuse angle
2239,Thinks there are 50 weeks in a year
1800,Believes multiplying two positives gives a negative answer
604,Gives probability as an integer instead of a fraction
909,Mixes up squaring with dividing by 2
158,"Believes addition comes before indices, in orders of operation"
1444,Does not understand that the negative outside the bracket means answer will be negative
572,Writes repeated letters instead of using index form of a variable
1175,Uses base instead of height as h in area of a trapezium formula
1779,Does not recognise that a shape translated would not change orientation
821,Mistakes rotations for translations
181,Assumes a ratio is part to part instead of part to whole
2368,Converts a fraction to a percentage by placing a decimal point between the numerator and denominator
664,"Believes -a is always smaller than a, ignoring the possibility that a is negative"
1363,Uses 2 letters to describe an angle
1864,Does not realise that the order is important in a ratio
210,Thinks the term in a sequence is double the position value
1793,Does not count end number when counting
2351,Believes to find the angle for a pie chart sector you calculate 360 divided by the frequency of that sector
1846,Is not able to spot a proportional relationship pictorially unless they are laid out in groups
1959,Does not know that a solid is a 3D shape
1083,Does not know the meaning of uniform cross section
185,Thinks a positive y value in a column vector means to move down rather than up 
1663,Thinks halving is the same as multiplying by 2
278,Believes a power of 2 has no impact on its value
1099,Believes gradient at a point = y coordinate/x coordinate
2263,Does not understand the root power of 4
782,Mixes up quantitative and qualitative data types
1327,Does not know the meaning of attribute data
1845,"When multiplying involving a multiple of 10, just multiplies the digits and ignores the zeros "
2508,Thinks x = ? is the y axis
26,Thinks x = ? or y = ? is y = x
2443,Thinks y = ? is the x axis
2547,Multiplies instead of divides when division is written as a fraction
2520,Believes the fraction line represents addition
493,Thinks you add the number of wholes to the numerator when converting a mixed number to an improper fraction.
1431,"Believes you add the whole to the numerators, ignoring denominators, when adding a mixed number to a proper fraction with the same denominator."
315,Has not realised that the answer may be changed by the insertion of brackets
260,Thinks cubing a number means adding 3 to that number
600,Thinks a horizontal line on a distance time graph means a distance of 0
1598,Believes the solution to an equation with matching coefficients of variables on both sides will always be 0
1302,"In ratio question where the difference between the sides is given, uses that as one part without dividing"
169,"When subtracting a fraction from a mixed number, assumes they just subtract the numerator from the integer of the mixed number"
1166,"When subtracting a fraction from a mixed number, assumes they subtract the numerator from the integer and the numerator of the mixed number"
1871,"Thinks factorising a quadratic means factorising the variable terms into a single bracket, and leaving out the constant"
2510,Only reads the percentage symbol as applying to the units digit
1469,Does not recognise when simplifying a fraction may be helpful
588,Thinks 10l = 1 cubic metre
338,Believes only straight lines count as edges on 3D shapes
1608,Believes parts of a 3D diagram that look straight class as edges
1624,Multiplies the number of whole units by the numerator when converting from a mixed number to an improper fraction
1261,Thinks if you multiply a fraction by itself you get a whole
2098,Multiplies all terms together when simplifying an expression
1696,Heads towards zero when subtracting from a negative
326,"When converting fractions to ratios, puts the other side of the ratio as the total of the numerator and denominator"
1048,"When adding/subtracting fractions, adds/subtracts the denominators and multiplies the numerators"
1985,Has multiplied base by slant height and perpendicular height to find area of a triangle
1333,Halves base but still divides product by 2 when finding area of a triangle
2499,Thinks the interior angles of any polygon add up to 180 degrees
940,When writing a function as a function machine confuses the input and the output.
251,"Includes a data point with the value, when asked to find the number of data points below a value"
1669,"In 3 letter angle notation, gives a wider angle that contains the shaded angle"
2212,Mixes up smallest and largest when ordering fractions
296,Ordered fractions by comparing denominators rather than using equivalent fractions.
1667,When comparing unit fractions believes that fractions with larger denominators are greater in size.
1595,Believes the first multiple of a is 2a
1602,Believes the sum of change in x and change in y gives the distance between points
2415,Thinks that square root is found by dividing by 4
2210,Ignores colours or design on shape when looking for symmetry
1902,Gets the minutes and hours the wrong way around
2297,Believes total frequency in a table is found by counting rows
507,Believes the total frequency is the overall total in a grouped table
2343,Believes total frequency in a table is given by the sum of the categories given
2191,When writing a number as a percentage of another number gets them the wrong way around
1703,When using a 180 degree protractor to measure reflex angles gives the value of the acute or obtuse angle that is a complement to 360
2535,Does not add on 180 degrees when using a protractor to measure a reflex angle
2380,Believes f(x) - a translates the function up a units
362,Believes f(x) - a translates the function right a units
262,Believes the intersection in a prime factor venn diagram does not contribute to the size of the number represented by a circle 
2003,Believes multiply all numbers in a prime factor venn diagram gives the value of one sets number
1861,Rounds to nearest 50 not 20
1163,Does not understand you can round to numbers other than powers of 10
2214,"Thinks that in the equation y=a, a is the gradient"
1534,Thinks that doubling and then doubling again is not the same as multiplying by 4
2114,"When completing the square, believes a coefficient of x^2 does not affect the value of the constant inside the bracket"
1870,Thinks there are 10000mm in a metre
229,Does not account for scale on diagram
2226,Incorrect use of scale on a diagram
2020,"When simplifying surds, does not use the largest square number to simplify"
2112,Does not understand how to find percentages of an amount
247,Found the percentage but added it to 100%
2199,Divides by the numerator and multiplies by the denominator when finding a fraction of an amount
1993,Believes total in a grouped table is found by counting rows
2111,"Believes you do not include an ""other"" category when finding a total frequency"
1850,Mixes up square rooting and fourth rooting
376,Unable to equate a division and multiplication to a single division
976,"Thinks a Fibonacci sequence must start with 1, 1"
89,Thinks it can't be called a sequence with a repeated number at the start
2081,Thinks there are 7 hours in 1 day
2401,Answers as if there are 60 hours in a day
922,Believes we can only take the square root of a perfect square
1024,When solving an equation thinks they add when in fact they need to multiply
2208,"When writing ratio, writes total as one side"
1237,Believes that 1 part of a bar model will always have a value of 1
653,Does not have when calculating the area of a triangle
467,Treats zero as a ten when subtracting
19,"When multiplying a surd by an integer, adds the integer to the number under the surd"
2082,"When multiplying a surd by an integer, multiplies the integer with the number under the surd"
754,Does not recognise that an integer multiplied by a surd can be simplified
183,Has confused cube numbers with prime numbers
780,Believes the constant only gives the y-intercept for linear graphs
654,Believes an interior angle in a regular polygon can be found using 180(n+2)/n
1907,Believes an interior angle in a regular polygon can be found using 360 subtract (180 over number of sides)
1896,"When finding the gradient from the equation of a line in the form ax + by = c, believes b/a is the gradient"
567,"When doing operations with decimals, ignores significant zeros after the decimal point"
2152,Believes every number is the mode when you have data with no mode
1550,Believes interior angles are outside a shape
730,Ends up £1 out when dealing with change in money
2189,Believes isosceles triangles cannot have right angles
954,"Confuses adding 3 with cubing, in algebra"
1357,Thinks only labelled dimensions need to be included when calculating the perimeter
2135,Thinks positive or negative sign affects the term before it
1702,Does not know the 9 timestable
2150,Does not know the 6 timestable
1308,"Thinks tables of values are symmetrical about (0,0)"
902,Thinks 1 squared is 2
623,Assumes the denominator is divided by the numerator
1151,Believes they can round when converting units
451,Does not recognise parallel lines angle rules applied inside a shape
785,Confuses co-interior and alternate angles
280,Describes lines when asked to describe angles
946,Believes a proportion of a whole is whole/part not part/whole
1329,Believes it is not possible to calculate the frequency for a pie chart sector despite being given enough information to do so
712,Believes you can not take away a larger number from a smaller one
263,"Does not understand direction of North East, North West, South East and South West cardinal points"
1040,Does not measure bearing clockwise from the north line
1614,Believes factors of algebraic terms/expressions will only be numbers
1524,Believes adding b to any integer gives a multiple of b
845,Believes they can find the nth term based on the first term only
2027,Believes that an + b is still a multiple of a
2238,Divides rather than multiplies when scaling up in direct proportion problems
1618,Mixes up cubing and multiplying by 3
138,"When solving a problem using written division (bus-stop method), does the calculation from right to left"
1140,"When simplifying surds, adds the number on the outside of the surd to the number under the surd"
1640,Believes the centre of rotation is always the origin
1862,Performs addition ahead of division
374,Thinks a hexagon has 8 sides.
1767,Does not realise that a pictogram needs a title or question
252,Does not think 'other' is an acceptable category for data
426,Believes corresponding angles sum to 90 degrees
709,Adds instead of subtracts when using an area model for multiplication
1295,"When finding part of the area of a shape, subtracts from the side length before multiplying but still subtracts the unshaded area too."
1560,Mistakes the number of rows for the total frequency in a frequency table
2166,Adds up the variable column when asked for total frequency
1895,Does not realise that all circles are similar
16,Believes that graphs of inverse proportion meet the axes
1384,"When reading decimals on a number line, assumes each dash is 0.5"
542,Believes constructing a perpendicular gives an angle of 60 degrees
1017,Does not understand how to solve linear two step equations
109,Thinks a factor of the final digit is also a factor of the whole number
1399,Fails to identify any rotational symmetry 
455,Subtracts 1 rather than 2 from the number of sides when finding the sum of interior angles
1426,Thinks rule for calculating interior angles only applies to regular polygons
117,"Believes that in completed square form, they need to change the signs of both values to get the turning point"
895,Believes a line of reflection must be touching the original shape
58,"When dividing, confuses the remainder with the quotient"
745,Confuses midpoint and distance between two points
1386,Confuses the method for finding the gradient and length of a line segment
1511,Does not understand that the probability of something not happening is 1 minus the probability of it happening
1283,Believes a polygon can have curved sides
270,Thinks the term polygons only applies to shapes with more than 3 sides
1049,Misunderstands the process of making a variable the subject of an equation
1674,Believes distance is the area under the graph on a displacement time graph
119,Believes distance = speed + time
1436,Confuses cubic and exponential graphs
76,Confuses quadratic and exponential graphs
1946,Believes numbers are divisible by numbers which sum to their factors
573,Thinks numbers are divisible by all multiples of their factors
1490,Writes fraction rather than fraction of amount
1260,Gives number of sections of pie chart rather than the amount it represents
2204,Believes the area of a rectangle is calculated by length add width
1886,Does not understand that base angles in an isosceles are equal
842,Confuses the calculations for HCF and LCM
1950,forgets to include the common factors when calculating the lowest common multiple
2515,Rounds too early in calculation 
1427,Believes cube numbers are just multiples of 3
408,"When multiplying fractions, multiplies both the numerator and denominator"
2573,Believes the solution to mx + c = a is the y intercept of y = mx +c
626,Thinks the difference between a positive number and a negative number is equal to the positive number
2006,Believes the mean is total divided by sum of categories given
1470,"Does not know the meaning of the word ""product"""
1356,Confuses the use of LCM and HCF in real life examples 
1782,Does not recognise miles as a unit of length
45,"When asked for the value of a digit, gives an answer 10 times too big"
2402,"When asked for the value of a digit, gives an answer 10 times too small"
2485,"Thinks that times just before midnight are ""am"" times"
1636,Believes nth term rule can be given in words
1858,Does not compensate when subtracting
666,Thinks grams and tonnes are the same
2072,Confuses formulae for area of triangle and area of rectangle
14,Does not understand how to create a multiple of an equation
1484,Thinks 1l = 10 000 cubic centimetres
1836,Believes lines of symmetry must be vertical or horizontal
1071,Confuses obtuse and acute angles
1691,Believes the solution of mx + c = 0 is x =0
1776,Believes they solve mx + c = 0 by substituting in x = 0
244,Believes the solution of mx + c = 0 is x = m
1763,Confuses arc and diameter
1661,Confuses circumference and diameter
