MisconceptionId,MisconceptionName
2541,"When finding the square root of a decimal, believes the answer should have the same number of decimal places"
2545,Does not know that prime numbers have exactly two factors
2548,Does not increase the denominator when an item is added in a probability question
2552,"When adding decimals, thinks the answer has to have the same number of decimals as the total in the question"
2553,Gives the second significant figure when asked for the first
2556,Thinks the subtraction sign means multiply
2557,Mixes up cubing and squaring
2559,When dividing numbers with different bases subtracts the powers but divides the base numbers.
2560,Confuses the formulas for the perimeter of a sector and the area of a sector 
2562,Confuses the lower and upper bound
2564,Gives the intersect value of a Venn diagram when asked to find the value of a set only
2567,Believes they only need to multiply the first pair of terms when expanding a double bracket.
2568,Believes all the multiples of a number will also be multiples of its multiples
2570,Confuses interior angles with exterior angles
2571,"When dividing numbers with different bases, divides the powers and divides the base numbers."
2574,Believes that when multiplying by a power of 10 you add zeroes after the decimal point
2575,Thinks adding same amount to each side of a ratio gives an equivalent ratio
2578,"Mixes up sides of a ratio, when working with vectors for line segments."
2580,Believes degrees can be used to measure length
2582,"When multiplying numbers with the same base, multiplies the powers "
2584,Believes that any percentage of a larger number will be greater than any percentage of a smaller number
