MisconceptionId,MisconceptionName
2162,"When rounding to decimal places and the only digits after the decimal point will be zeros, just gives the integer as the answer."
2002,"When dividing a decimal by an integer, divides by the wrong power of 10 when reinserting the decimal."
708,Believes switching the x and y variables in a linear equation gives a perpendicular line
1449,Believes rounding numbers down would give an overestimate
762,Chooses an example when asked for a counter-example
852,Thinks there are 100 mg in a gram
213,Thinks there are 10 mg in a gram
2038,Believes a common denominator can only be the lowest common multiple
2128,Believes a common denominator must always be the two denominators multiplied together
1022,Believes you multiply matching bases when carrying out a multiplication
1517,Finds unit amount but doesn't multiply up
1193,Multiplies up without finding unit amount
2476,Does not write the place holder zero when doing column multiplication
195,"When solving an equation, thinks the divisor and dividend are the opposite way around"
1231,Does not know that 7 and -7 are different
757,Adds rather than multiplies when asked for a product
1599,Adds rather than divides when answering worded problems
1270,Divides by 10 instead of 100 when converting a percentage to a decimal 
1223,Uses numerators to convert fractions to ratio despite different denominators
2180,Divides instead of multiplies when calculating total frequency
932,Adds instead of multiplies when calculating total frequency
2501,Subtracts rather than multiplies when calculating total frequency
223,Mixes up cubing with multiplying by 10
988,"When converting a percentage to a decimal, just writes all the digits after a decimal point."
2414,Believes a variable must remain unknown and cannot be substituted with a value
1173,Uses the numerator of an improper fraction as the denominator of the equivalent mixed number
2105,Has used slant height and base to find area rather than perpendicular height and base
1204,Multiplied by 100 rather than divided by 100
355,Thinks the interior angle of a regular polygon is 10n
35,Believes you add 2 instead of subtracting 2 to the numbers of sides when finding total interior angles
927,Assumes that opposite angles in a quadrilateral sum to 180 degrees
2432,Does not know the properties of a parallelogram
353,Does not recognise when one part of a fraction is the negative of the other
2388,Uses formula for area of a parallelogram when finding the area of a trapezium
2197,Thinks you multiply parallel sides to find the area of a trapezium
305,Does not know the formula for area of a trapezium
1443,"Thinks that when raising a variable with a coefficient to a power, only the coefficient is affected by the power"
2217,Thinks subtracting a negative makes your answer smaller
637,Does not recognise the corresponding sides in similar shapes or enlargements
1464,"When solving simultaneous equations graphically, they think the solutions are the y-intercepts"
1266,"When solving simultaneous equations, thinks they can ignore one of the variables"
1957,"Reads 10,000 as 1000"
2149,Converted seconds to minutes instead of seconds to hours
1718,Thinks there are 100 seconds in an hour
508,Thinks there are 1000 seconds in an hour
783,Thinks the sign of solutions in a quadratic equation is always the same as the constant term
471,Believes that the solution to ax + b = 0 is x = -a/b
464,Believes that you are unable to calculate the sum of the interior angles of an irregular polygon given the number of sides
1738,Uses sin when cos is required
501,Uses tan when cos is required
1394,Identifies the first term rather than the next term in a sequence
1262,"Believes that they can fully factorise an expression by taking out any common factor, not just the HCF"
1666,"When factorising into single brackets, factorises the first term correctly but subtracts the number outside the bracket with the second term in the expression to find the second term in the bracket"
1914,Converts fraction to percentage by multiplying the denominator by 10
3,"Thinks a quadratic without a non variable term, can not be factorised"
2465,Believes reflection in y = -x changes sign of x coordinate only
1541,Believes reflection in y = -x changes sign of y coordinate only
409,Identifies first decimal place value when asked for first significant figure
2139,"When finding the nth term rule for a quadratic sequence, believes that the coefficient of n is half the second difference"
717,Believes the amount given is for the whole rather than a part
2314,Multiplies instead of divides to find one part given the total
1144,"Believes the equation for a horizontal line is in the form xy = a, where a is the y intercept"
2022,"
Has incorrect belief about the meaning of ""expression"""
1311,"
Has incorrect belief about the meaning of ""formula"""
1757,Lists outcomes rather than counts how many outcomes
864,Reads 0 on protractor as size of angle when angle is not in usual orientation
872,Thinks angles can only be measured when one line is horizontal
519,"When asked for factors of an algebraic expression, thinks a term will be a factor"
84,Believes greater than/less than symbols include end values
765,Thinks there are 10kg in a tonne
663,Forgotten placeholders when rounding to significant figures
602,"Thinks multiplying two or more negative numbers together always gives a positive answer, regardless of how many negative numbers there are in the sum"
447,Believes dividing by 0.1 is the same as dividing by 10
345,Has treated this like an addition problem and added the ones column.
60,"Has written the value of the 'ones' column as the answer, withiut using the numbers in the question."
1571,When writing standard form does not give the correct power of ten
1611,Does not understand that coordinates can be decimals
37,Rounded to wrong degree of accuracy (2sf not 1sf)
1819,Confuses order of sides in a trigonometric ratio
404,Uses cos when sin is required
2466,Uses tan when sin is required
1274,Subtracts simultaneous equations when addition is required
1123,Subtracts rather than dividing to find unit price
1635,Believes gradient is the difference between the change in x and the change in y
439,Believes gradient = change in y multiplied by change in x
1694,Believes that a discriminant of 0 means there are no real solutions
1547,Has forgotten to convert cm to m
751,Believes you add the terms together when multiplying like terms.
611,"When two digits sum to 10 or more during addition of decimals, does not carry across decimal point to preceding digit."
2285,"In a function machine, confuses the first operation and the input"
2374,Believes a quarter of 2 is 0.25
100,Believes angles in a triangle sum to 360 degrees
2516,Thinks 3-letter angle notation has to use the nearest vertex on each side of the angle
2554,Thinks the diagonal of a square is the same length as the side of the square
1671,Does not know how to find area by counting squares on a grid
318,"Assumes that converting a decimal percentage to a fraction, they can just convert the decimal to a fraction, instead of writing the decimal over 100."
1759,Assumes decimal point can be ignored when given a decimal percentage to convert to a fraction
764,Confuses octagon and pentagon
948,Believes squaring is the same as adding two
937,"When adding or subtracting surds, simplifies the surds correctly but puts the digits in the answer the wrong way round"
349,"When adding surds, just multiplies the numbers under the surd rather than first trying to simplifying to find like surds"
1604,Thinks there are 10 centimetres in 1 mm.
629,Thinks there are 1000mm in a centimetre
1539,Does not consider that all three angles in a triangle sum to 180 degrees
1851,Does not know the properties of an isosceles triangle
366,Does not know the meaning of the identity symbol
2309,Thinks they can just give the probability of the first event for a combined probability
1259,Believes division is sometimes commutative 
2077,"Believes that when eliminating a variable, if the signs of the terms with matching coefficients are different, we subtract the equations."
2550,Thinks there are 10m in a km
1481,"When describing a translation, miscounts when crossing an axis"
1142,"When converting from an improper fraction to a mixed number, adds on the part left to make the whole, rather than subtracting it"
984,Writes the numerator of an improper fraction as the number of wholes when converting to a mixed number
1033,Does not know that you can have a decimal percentage
1989,Believes a coordinate cannot be placed beyond the bounds of the grid shown
972,Does not realise that if the horizontal and vertical measurements of a diagonal line segment switch it remains the same size
1467,Believes the power button writes a fraction
1987,"When completing the square in the form (x - a)^2 + b, believes b = the original constant"
1994,"When completing the square in the form (x - a)^2 + b, believes b = -a^2 regardless of the original constant"
1814,Confusion over whether multiplication or division is the correct way to solve the problem.
724,Thinks the denominator in a combined probablity will be the same as the denominator in the probability of the first event.
1196,"When solving an equation where there is a negative sign in front of the variable at the final stage, believes they can ignore it and treat it as if it's positive"
2145,Believes an upward slope on a distance-time graph means travelling back towards the starting point.
1945,Believes an upward slope on a distance-time graph means the movement has stopped
1813,Estimates the length of diagonal lines rather than working out based on horizontal and vertical measurements
591,Does not believe the length of a diagonal line can be worked out based on horizontal and vertical measurements
1398,Divided by 100 rather than 1000
424,Adds 3 decimal places rather than moving 3 places
1831,Does not know the properties of a cylinder
1893,"Believes the y intercept is given by the difference between the x and y coordinates of any point on the line, not just the point (0, c) "
2525,"When dividing decimals, divides rather than multiplies when reinserting the decimal."
2045,Writes a variable to the power of n as nx
2543,"Believes the frequency represented by a pie chart sector can be judged visually, without considering the total it represents"
815,Counts in the wrong direction on a number line
1633,When asked to rotate by 180 degrees rotates by 90 degrees
2572,Rotates by the wrong center of rotation (not including the origin)
1657,Doubles the diameter when finding the radius
2221,Has made an order of operations mistake when writing a formula from a given situation
1854,Confuses tangent and radius
649,"Beileves you can use the full length when finding an area of part of a composite shape, when part of the length is needed"
1641,"When collecting like terms, only simplifies when there is an addition"
1752,Believes the arrows for parallel lines mean equal length
2357,Thinks sign for parallel lines just means opposite
900,Believes the constant gives the y-intercept even when a line is not written in the form y = mx + c
639,Believes unrelated acute/obtuse angles in a diagram are supplementary
287,Thinks y = ? is a vertical line through ?
875,Believes vertically opposite angles sum to 360 degrees
858,Believes splitting a multiplication using the distributive property is the same as splitting it into factors
1058,"Believes that in the nth term of a descending sequence, b is the difference between the term and the positive multiple of n"
232,"When dividing by a fraction, switches to multiplication without also using the reciprocal"
1433,"When factorising into single brackets, only factors out the numerical values and forgets to factorise possible variables"
1102,Believes that addition should be used when finding the difference between two values on a time series graph
2160,"In repeated percentage change, believes the second change is only a percentage of the first change, without including the original"
924,Believes to find the proportion of a pie chart sector you do frequency/sum of other frequencies rather than frequency/overall total
1307,Finds the degrees for 1 person rather than the required number of people for a pie chart sector
49,Doesn't believe that when you divide by 0 the answer will always be 0
2100,Divides rather than multiplies when answering worded problems
1972,Subtracts rather than multiplies when answering worded problems
1063,Adds rather than multiplies when asked for a total
1794,Does not recognise that choosing 2 items at once means the first item does not get replaced in a probability question
2110,Identifies a common multiple of two numbers when asked to consider a common multiple of three numbers
2260,Identifies a multiple of a number but not a common multiple of a group of numbers
1885,Thinks a power raised to a power leads to addition of the powers
201,Believes substituting the starting value into an iteration formula immediately gives the solution
1823,"When there are two modes, finds the mean of these values and gives that as the mode"
2069,"Believes if there are two numbers with the same frequency, there isn't a mode"
2117,Thinks that all angles anywhere along a straight line add to 180
2161,Confuses octagon and hexagon
2291,"When solving simultaneous equations, thinks they can't multiply each equation by a different number"
923,Thinks index notation represents repeated addition rather than repeated multiplication
997,Subtracts instead of multiplies
1268,"When solving simultaneous equations, thinks you only transform the algebraic terms, rather than the whole equation."
614,"When solving simultaneous equations, thinks you only transform the term that is being eliminated, rather than the whole equation."
1030,When dividing numbers with the same base divides the base numbers and the powers
812,When dividing numbers with the same base correctly subtracts the powers but divides the base numbers.
633,Does not understand how to subtract algebraic fractions
814,Confuses circumference and radius
2193,Confuses tangent and circumference
1229,Confuses chord and circumference
1036,"Only gives 1 value of x for a given value of y, when reading from a parabolic graph"
1912,Gives the probability out of the number of non-successes rather than the total
289,Writes the numerator and the denominator the wrong way round in a probability
1832,Confuses linear and reciprocal graphs
1235,"When completing the square in the form (x - a)^2 + b, believes b is the difference between a and the constant of the original quadratic"
688,Confuses the factorised form of repeated roots and the difference of 2 squares
1075,When asked to add fractions uses the method for multiplying fractions instead.
2307,Thinks you can divide the variables and the numerical values by different numbers when simplifying an algebraic fraction
466,"When calculating with numbers in standard form, just applies the operation to the number and the power separately"
383,confuses cubic and reciprocal graphs
756,Believes unit fractions with a difference of 1 in the denominator have no other fractions between them
1415,Assumes every dash on a scale represents an increase of 1
2484,"When converting from an improper fraction to a mixed number, just writes the tens digit as the number of wholes"
0,Does not know that angles in a triangle sum to 180 degrees
279,Mixes up square rooting and cube rooting
1841,Thinks the number of wholes in a mixed number represents the tens from the numerator of an improper fraction
1479,Thinks you multiply by the numerator and add the denominator when converting a mixed number to an improper fraction
1304,Confuses lines of the form y = a and y= ax
1167,Does not recognise millimetres as a unit of length
719,Does not recognise feet (ft) as a unit of length
735,"In ratio where total is given, treats that as one part without dividing"
1371,"When drawing bar diagram for ratio, shows the total as the difference between parts"
2428,"When drawing bar diagram for ratio, shows the total amount as the total of one side"
1218,Multiplies the numerators when adding fractions with a common denominator
202,"When asked to add fractions, multiplies instead"
2321,does not know the meaning of the word digit
1810,Thinks x = 1 at the x axis
285,Lines up the digits incorrectly when doing an addition involving two numbers with a different amount of digits
628,"When factorising, finds a factor that goes into only the first term of the expression"
1748,"Believes that when a shape touches the mirror line, all of its vertices will stay the same when reflected"
101,Believes that reflection always switches the x and y coordinates
2319,subtracts the highest from the lowest when calculating the range
2530,Subtracts instead of adds when using inverse operations to solve an equation
1187,Does not realise that gradient represents rate of change
176,Believes that a reciprocal equation is defined when the denominator is 0
871,Does not include brackets when attempting to multiply an expression
1032,Confuses cube rooting with squaring a number
2181,Performs addition ahead of subtraction
2470,Believes the mode is the most common frequency rather than the highest frequency
2269,"When finding the distance between coordinates, includes the starting number"
1483,Believes vertically opposite angles sum to 90 degrees
66,Repeats the digits three times when cubing a number
587,"Thinks that when adding decimals with a different number of decimal places, you should line up the digits to the right "
441,Does not recognise a unit of volume
2140,Believes division is carried out before a power
981,Believes inequalities cannot be combined
1256,Believes the difference of 2 squares method of factorising also works for the addition of 2 squares
796,Draws both angles at the same end of the line when constructing a triangle
2288,"When multiplying decimals, does not realize that the order and position of the digits (relative to each other) has to remain constant."
2175,"Mixes up squaring and multiplying by 2 or doubling, and not square rooted"
2092,Error finding percentage value after finding 1%
211,Believes displacement continues to increase even when returning to starting point
205,Thinks there are 1000mm in a km
526,Thinks there are 10000mm in a km
2333,Thinks there are 10 million mm in 1 km
1118,Thinks the smallest bar in a bar chart is the mode
1146,"When solving simultaneous equations, believes the terms must be of opposite signs in order to be eliminated."
370,"When solving simultaneous equations, believes the terms must have the same sign in order to be eliminated."
2148,"When simplifying, thinks they write 0 in front of a negative number in the final answer, instead of just writing the negative number"
1172,Thinks any 2 values multiplied together can be denoted with a squared symbol
1996,Only includes fully shaded squares when counting area
248,Believes a pie chart makes 360% not 360 degrees
1376,Thinks that a larger shaded area represents a larger fraction
1212,Thinks a greater number of shaded parts represents a greater fraction
152,"Believes that the smaller a divisor is, the smaller the answer will be"
643,Think 1km = 1 mile
1124,When ordering numbers in standard form just looks at the decimal without multiplying by a power of 10
793,Forgets to subtract sum of angles we know from 180 to find missing angle in a triangle
898,Thinks x = 0 is the x axis
1422,Does not recognise km as a unit of length 
1725,"Does not recognise inches ("") as a unit of length"
1119,Does not interpret the correct order of operations in a fraction when there is an addition on the numerator
1866,Confuses additive and multiplicative relationships
449,"Does not realise we can scale the perimeter as a whole, rather than finding individual side lengths"
879,Thinks you apply one inverse operation to one term and the other inverse operation to the other term
297,Forgets you need a compass to draw arcs
2157,"Believes that when eliminating a variable, if the signs of the terms with matching coefficients are the same, we do the operation matching the sign (+ if positive, - if negative)"
303,"Believes that when eliminating a variable, if the signs of the terms with matching coefficients are the same, we do the operation inverse to the sign (- if positive, + if negative)"
1749,"When dividing fractions, does the reciprocal of both fractions"
2581,"When factorising a quadratic with a coefficient of x squared, believes the signs and/or positions of the constants are interchangeable"
1165,Rounds to the nearest integer rather than one significant figure
1591,"Rounds to the nearest hundredth, rather than one significant figure"
2450,Does not half sum of parallel sides when finding area of a trapezium
977,Confuses the sign for parallel lines as being dashes
2289,Confuses the signs for straight lines as being dashes
1340,Misunderstands dashed lines as being the midpoint
1840,Thinks the fraction button on a calculator converts fractions to decimals
136,Does not recognise a reciprocal equation
127,Thinks the fraction to decimal conversion button on a calculator can be used to raise to a power
1760,"Reads the position of a number from the space between the line marked, rather than the line marked"
2049,Believes a gap of 2 is a gap of 1 on a numberline
1031,Believes raising a negative number to an odd power will give a positive answer
668,Writes four symbols after rather than one before in Roman numerals
1553,Thinks that we can use O as zero for place value in Roman numerals
382,Does not know how to combine different symbols in Roman numerals
1110,Does not think that -n + n = 0
1004,Thinks that a number in front of a bracket means divide
987,Believes that the order of a worded calculation should be changed to follow BIDMAS 
468,Believes you find the frequency for a pie chart sector by calculating its angle divided by the total frequency
402,Does not know the definition of a cone
816,Only counts visible faces
1215,"Includes a data point with the value, when asked to find the number of data points above a value"
1455,Calculates circumference when asked for area
2286,Believes the length of the line in a velocity time graph gives the distance (rather than the area underneath that line).
1116,Multiplies coefficients and letters separately and writes as an addition
137,Does not know the meaning of the word identity 
511,Ignores the negative sign when thinking about the value of a term
194,"Believes the sides of a square must be horizontal and vertical, not diagonal"
495,Thinks converting an integer to a fraction means both the numerator and denominator are equal
589,Believes extreme values can affect the median
1992,Believes extreme values can affect the mode
1126,Believes the mean is always representative
2424,Believes a line segment can be opposite an axis
2122,Thinks two letters next to each other is a division
1875,Has used a subtraction sign to represent division
914,Finds 10% of an amount rather than the percentage being asked
1710,"When finding a percentage of an amount, assumes they divide the percentage by 10, but not the amount, before multiplying"
515,Does not know a rectangle is a type of parallelogram 
1041,Does not know a rhombus is a type of parallelogram 
994,"When completing the square in the form (x - a)^2 + b, believes b = a^2 + the original constant"
2349,Forgets that a number divided by itself is 1
832,Believes that a fraction with equal numerator and denominator cancels to 0
1203,Believes that to find an angle for a pie chart sector you divide the total frequency by 360 and multiply by its frequency
1673,Multiplied by 1000 instead of 100
1320,Multiplied by 10 rather than 100
1695,Thinks you add all the bricks in a row in an addition pyramid.
1586,"When asked to read a value from a graph, thinks they give the corresponding value on the other axis, rather than reading from the graph"
171,"When simplifying surds, does not multiply the number in front of the surd with the square root of the largest square number that has been removed from the surd"
1676,"When adding or subtracting surds, does not simplify the surd before adding the numbers in front of the surd"
1929,Does not understand the concept of inverse operations in algebra
1442,Think cross section of a prism is the biggest face
239,Finds a common multiple but not the lowest common multiple
2364,Believes all possible outcomes must have equal probability
1209,Believes a mixed number can contain an improper fraction
1613,Believes constructing a triangle with given SAS requires a compass
794,Rounds up rather than to one significant figure
652,Mixes up the numerator and denominator when writing a division as a fraction
2107,"Student thinks that negative decimals behave the same as positive decimals when positioning a decimal between two consecutive negative integers, placing the decimal with a greater absolute value to the right. "
1018,Thinks the fraction 1/n can express sharing n items between any number of people
1293,Identifies how much repeated use of the term-to-term rule changes a number but does not apply to the sequence
153,"When dividing decimals with the same number of decimal places as each other, assumes the answer also has the same number of decimal places"
1733,Confuses tangent and chord
1741,Confuses diameter and chord
1367,Thinks a dashed line marking a region means the line is included
876,Believes squaring a negative number just changes the sign
454,Thinks measures of area must end in squared
2125,"When multiplying a multiple of 10, just multiplies the non-zero digits"
1577,Adds instead of multiplies when using grid method
2399,"when dividing a fraction by an integer, both multiplies the denominator and divides the denominator"
2447,Believes the reciprocal button writes a fraction
1609,Believes the decimal point button writes a fraction
